ID	Date	Title	First_Author	Year	Venue	Cite_Key	Status	Repro	Valid	Claims	Pedagogy	Longevity	Book_Location	Notes
1	2025-12-22	AlphaGenome: AI for better understanding the genome	Avsec	2025	Google DeepMind	avsec_alphagenome_2025	MONITOR	1	1	OVER	M	?	Ch13 (genomic sequence modeling)	
2	2025-12-22	[Enformer] Effective gene expression prediction from sequence by integrating long-range interactions	Avsec	2021	Nature Methods	avsec_enformer_2021	INCLUDE	2	2	OK	M	+	Ch13 (genomic sequence modeling)	
3	2025-12-22	chen_deepsea_2022				chen_deepsea_2022	CITED	1	1	OK	M	?	Ch13	Placeholder citekey; needs resolution; No DOI/URL in BibTeX
4	2025-12-22	A genome-wide framework for mapping gene regulation via cellular genetic screens		2019		gasperini_genome-wide_2019	INCLUDE	2	2	OK	M	+	Ch13 (genomic sequence modeling)	No DOI/URL in BibTeX
5	2025-12-22	[Basenji2] Sequential regulatory activity prediction across chromosomes with convolutional neural networks	Kelley	2018	Genome Research	kelley_basenji_2018	INCLUDE	2	2	OK	M	+	Ch13 (genomic sequence modeling)	
6	2025-12-22	[Borzoi] Predicting RNA-seq coverage from DNA sequence as a unifying model of gene regulation	Linder	2025	Nature Genetics	linder_borzoi_2025	INCLUDE	2	2	OK	M	?	Ch13 (genomic sequence modeling)	
