ID	Date	Title	First_Author	Year	Venue	Cite_Key	Status	Repro	Valid	Claims	Pedagogy	Longevity	Book_Location	Notes
1	2025-12-22	TODO	TODO			dallago_flip_2021	CITED	1	1	OK	M	?	Ch20	No DOI/URL in BibTeX
2	2025-12-22	TODO	TODO			de_almeida_bend_2024	CITED	1	1	OK	M	?	Ch20	No DOI/URL in BibTeX
3	2025-12-22	Genomic benchmarks: a collection of datasets for genomic sequence classification	Grešová	2023	BMC Genomic Data	gresova_genomic_2023	INCLUDE	2	2	OK	M	+	Ch20 (genomic sequence modeling)	
4	2025-12-22	EmbedGEM: a framework to evaluate the utility of embeddings for genetic discovery	Mukherjee	2024	Bioinformatics Advances	mukherjee_embedgem_2024	INCLUDE	2	2	OK	M	?	Ch20 (genomic sequence modeling)	
5	2025-12-22	ProteinGym: Large-Scale Benchmarks for Protein Fitness Prediction and Design	Notin	2023	Advances in Neural Information Processing Systems	notin_proteingym_2024	INCLUDE	2	2	OK	M	+	Ch20 (protein models/variant effects)	
6	2025-12-22	TODO	TODO			rao_evaluating_2019	CITED	1	1	OK	M	?	Ch20	No DOI/URL in BibTeX
